{
  "$schema": "https://json-schema.org/draft/2020-12/schema",
  "$id": "mimicanno/annotation",
  "type": "object",
  "required": [
    "schema_version",
    "episode_id",
    "task",
    "generated_at",
    "generator",
    "config_hash",
    "input_hash",
    "run_hash",
    "model_versions",
    "pipeline_phase",
    "pipeline_status",
    "segments",
    "boundaries_url",
    "signals_url",
    "notes"
  ],
  "properties": {
    "schema_version": {"type": "string"},
    "episode_id": {"type": "string"},
    "task": {
      "type": "object",
      "required": ["text", "version"],
      "properties": {
        "text": {"type": "string"},
        "version": {"type": ["string", "null"]}
      }
    },
    "generated_at": {"type": "string"},
    "generator": {
      "type": "object",
      "required": ["name", "cli_version", "pipeline_phase"],
      "properties": {
        "name": {"type": "string"},
        "cli_version": {"type": "string"},
        "pipeline_phase": {"type": "integer"}
      }
    },
    "config_hash": {"type": "string", "pattern": "^sha256:[0-9a-f]{64}$"},
    "input_hash": {"type": "string", "pattern": "^sha256:[0-9a-f]{64}$"},
    "run_hash": {"type": "string", "pattern": "^sha256:[0-9a-f]{64}$"},
    "model_versions": {
      "type": "object",
      "additionalProperties": {"type": ["string", "null"]}
    },
    "pipeline_phase": {"type": "integer"},
    "pipeline_status": {
      "type": "object",
      "required": ["object_state_available", "degraded_from_phase", "degrade_reason"],
      "properties": {
        "object_state_available": {"type": "boolean"},
        "degraded_from_phase": {"type": ["integer", "null"]},
        "degrade_reason": {"type": ["string", "null"]}
      }
    },
    "segments": {
      "type": "array",
      "items": {"type": "object"}
    },
    "boundaries_url": {"type": "string"},
    "signals_url": {"type": "string"},
    "notes": {"type": ["string", "null"]},
    "history": {
      "type": "array",
      "items": {
        "type": "object",
        "required": ["edit_type", "segment_id", "edited_at"],
        "properties": {
          "edit_type": {"type": "string"},
          "segment_id": {"type": "string"},
          "edited_at": {"type": "string"},
          "client_edit_duration_ms": {"type": "integer"},
          "reviewer": {"type": ["string", "null"]}
        }
      }
    }
  }
}
