{
  "boundaries_url": "boundaries.json",
  "config_hash": "sha256:7fa53b24ef3a341506dd36fbdeeeb6f1450c08fd607076a931d9ede97d618e1c",
  "episode_id": "episode_000002",
  "generated_at": "2026-04-30T12:00:00Z",
  "generator": {
    "cli_version": "0.1.0",
    "name": "mimicanno",
    "pipeline_phase": 4
  },
  "input_hash": "sha256:c2fe19141ae5a4214c3e8e07092be32e1f29660d4b610538d53b4135162cc6b2",
  "model_versions": {},
  "notes": null,
  "pipeline_phase": 4,
  "pipeline_status": {
    "degrade_reason": null,
    "degraded_from_phase": null,
    "object_state_available": false
  },
  "run_hash": "sha256:392200ec5fc905e38d6aaed09c575c8e7bb7eefee8fb3befff426cfd65a0fbdb",
  "schema_version": "1.0",
  "segments": [
    {
      "boundary_confidence": 0.85,
      "end_boundary": {
        "candidate_id": null,
        "score": 0.85,
        "sources": [
          "gripper_delta"
        ],
        "time": 0.2
      },
      "end_frame": 3,
      "end_time": 0.2,
      "episode_id": "episode_000002",
      "evidence": null,
      "failure_flags": [],
      "label_source": "signals_only",
      "label_version": "manipulation.v1",
      "object": null,
      "object_state_unavailable": true,
      "object_track_ids": [],
      "overall_confidence": 0.8,
      "phase": "idle",
      "reviewed": false,
      "reviewer_id": null,
      "segment_id": "episode_000002_seg00",
      "smoothing_ops": [],
      "start_boundary": {
        "candidate_id": null,
        "score": 0.85,
        "sources": [
          "episode_start"
        ],
        "time": 0.0
      },
      "start_frame": 0,
      "start_time": 0.0,
      "target": null,
      "verb": null,
      "vlm_confidence": null
    },
    {
      "boundary_confidence": 0.86,
      "end_boundary": {
        "candidate_id": null,
        "score": 0.86,
        "sources": [
          "gripper_delta"
        ],
        "time": 0.5333333333333333
      },
      "end_frame": 8,
      "end_time": 0.5333333333333333,
      "episode_id": "episode_000002",
      "evidence": null,
      "failure_flags": [],
      "label_source": "signals_only",
      "label_version": "manipulation.v1",
      "object": null,
      "object_state_unavailable": true,
      "object_track_ids": [],
      "overall_confidence": 0.81,
      "phase": "approach_object",
      "reviewed": false,
      "reviewer_id": null,
      "segment_id": "episode_000002_seg01",
      "smoothing_ops": [],
      "start_boundary": {
        "candidate_id": null,
        "score": 0.86,
        "sources": [
          "gripper_delta"
        ],
        "time": 0.26666666666666666
      },
      "start_frame": 4,
      "start_time": 0.26666666666666666,
      "target": null,
      "verb": null,
      "vlm_confidence": null
    },
    {
      "boundary_confidence": 0.87,
      "end_boundary": {
        "candidate_id": null,
        "score": 0.87,
        "sources": [
          "gripper_delta"
        ],
        "time": 0.8
      },
      "end_frame": 12,
      "end_time": 0.8,
      "episode_id": "episode_000002",
      "evidence": null,
      "failure_flags": [],
      "label_source": "signals_only",
      "label_version": "manipulation.v1",
      "object": null,
      "object_state_unavailable": true,
      "object_track_ids": [],
      "overall_confidence": 0.8200000000000001,
      "phase": "grasp_object",
      "reviewed": false,
      "reviewer_id": null,
      "segment_id": "episode_000002_seg02",
      "smoothing_ops": [],
      "start_boundary": {
        "candidate_id": null,
        "score": 0.87,
        "sources": [
          "gripper_delta"
        ],
        "time": 0.6
      },
      "start_frame": 9,
      "start_time": 0.6,
      "target": null,
      "verb": null,
      "vlm_confidence": null
    },
    {
      "boundary_confidence": 0.88,
      "end_boundary": {
        "candidate_id": null,
        "score": 0.88,
        "sources": [
          "gripper_delta"
        ],
        "time": 1.0666666666666667
      },
      "end_frame": 16,
      "end_time": 1.0666666666666667,
      "episode_id": "episode_000002",
      "evidence": null,
      "failure_flags": [],
      "label_source": "signals_only",
      "label_version": "manipulation.v1",
      "object": null,
      "object_state_unavailable": true,
      "object_track_ids": [],
      "overall_confidence": 0.8300000000000001,
      "phase": "lift_object",
      "reviewed": false,
      "reviewer_id": null,
      "segment_id": "episode_000002_seg03",
      "smoothing_ops": [],
      "start_boundary": {
        "candidate_id": null,
        "score": 0.88,
        "sources": [
          "gripper_delta"
        ],
        "time": 0.8666666666666667
      },
      "start_frame": 13,
      "start_time": 0.8666666666666667,
      "target": null,
      "verb": null,
      "vlm_confidence": null
    },
    {
      "boundary_confidence": 0.89,
      "end_boundary": {
        "candidate_id": null,
        "score": 0.89,
        "sources": [
          "episode_end"
        ],
        "time": 1.2666666666666666
      },
      "end_frame": 19,
      "end_time": 1.2666666666666666,
      "episode_id": "episode_000002",
      "evidence": null,
      "failure_flags": [],
      "label_source": "signals_only",
      "label_version": "manipulation.v1",
      "object": null,
      "object_state_unavailable": true,
      "object_track_ids": [],
      "overall_confidence": 0.8400000000000001,
      "phase": "retreat",
      "reviewed": false,
      "reviewer_id": null,
      "segment_id": "episode_000002_seg04",
      "smoothing_ops": [],
      "start_boundary": {
        "candidate_id": null,
        "score": 0.89,
        "sources": [
          "gripper_delta"
        ],
        "time": 1.1333333333333333
      },
      "start_frame": 17,
      "start_time": 1.1333333333333333,
      "target": null,
      "verb": null,
      "vlm_confidence": null
    }
  ],
  "signals_url": "signals.json",
  "task": {
    "text": "mini test",
    "version": null
  }
}