{"boundaries_url": "boundaries.json", "config_hash": "sha256:00c8107fdea9686f0ec1cf948ea5afb97d4527d922f75980d1fbc3800a755b42", "episode_id": "episode_000000", "generated_at": "2026-05-12T12:58:29.479282Z", "generator": {"cli_version": "0.1.0", "name": "mimicanno", "pipeline_phase": 4}, "input_hash": "sha256:dc8780f2f78704f445956382527f99a335b503a3cd825983940ad826c1384bf1", "model_versions": {"sam3": "facebook/sam3", "sam3_checkpoint": "sha256:9999e2341ceef5e136daa386eecb55cb414446a00ac2b55eb2dfd2f7c3cf8c9e", "vlm": "/home/gayagaya/gemma_project/models/gemma-4-E4B-it:03449c82135c62749026e737a5d393f4fab212ee"}, "notes": null, "pipeline_phase": 4, "pipeline_status": {"degrade_reason": null, "degraded_from_phase": null, "object_state_available": true, "object_state_segment_coverage": 1.0}, "run_hash": "sha256:e350611063945b4e1bce196aec7cd05162af51ff7ad6a82f854af9d081f0fb7d", "schema_version": "0.2.0", "segments": [{"boundary_confidence": 1.0, "end_boundary": {"candidate_id": null, "score": 1.0, "sources": ["human_edit"], "time": 1.6}, "end_frame": 24, "end_time": 1.6, "episode_id": "episode_000000", "evidence": "Robot is moving towards the tape object.", "failure_flags": [], "label_source": "vlm_with_object_state", "label_version": "manipulation.v1", "object": "tape", "object_state_unavailable": false, "object_track_ids": ["obj:object:tape:0"], "overall_confidence": 0.9486832980505138, "phase": "approach_object", "reviewed": true, "reviewer_id": "takaki", "segment_id": "episode_000000__seg0000", "smoothing_ops": ["edited"], "start_boundary": {"candidate_id": null, "score": 1.0, "sources": ["episode_start"], "time": 0.0}, "start_frame": 0, "start_time": 0.0, "target": null, "verb": null, "vlm_confidence": 0.9}, {"boundary_confidence": 1.0, "end_boundary": {"candidate_id": null, "score": 1.0, "sources": ["human_edit"], "time": 3.6}, "end_frame": 54, "end_time": 3.6, "episode_id": "episode_000000", "evidence": "Robot is moving towards the tape object.", "failure_flags": [], "label_source": "vlm_with_object_state", "label_version": "manipulation.v1", "object": "tape", "object_state_unavailable": false, "object_track_ids": ["obj:object:tape:0"], "overall_confidence": 0.9486832980505138, "phase": "approach_object", "reviewed": true, "reviewer_id": "takaki", "segment_id": "episode_000000__seg0001", "smoothing_ops": ["edited"], "start_boundary": {"candidate_id": null, "score": 1.0, "sources": ["human_edit"], "time": 1.6666666666666667}, "start_frame": 25, "start_time": 1.6666666666666667, "target": null, "verb": null, "vlm_confidence": 0.9}, {"boundary_confidence": 1.0, "end_boundary": {"candidate_id": null, "score": 1.0, "sources": ["human_edit"], "time": 6.133333333333334}, "end_frame": 92, "end_time": 6.133333333333334, "episode_id": "episode_000000", "evidence": "Robot is moving towards the tape.", "failure_flags": [], "label_source": "vlm_with_object_state", "label_version": "manipulation.v1", "object": "tape", "object_state_unavailable": false, "object_track_ids": ["obj:object:tape:0"], "overall_confidence": 0.9486832980505138, "phase": "approach_object", "reviewed": true, "reviewer_id": "takaki", "segment_id": "episode_000000__seg0002", "smoothing_ops": ["edited"], "start_boundary": {"candidate_id": null, "score": 1.0, "sources": ["human_edit"], "time": 3.6666666666666665}, "start_frame": 55, "start_time": 3.6666666666666665, "target": null, "verb": null, "vlm_confidence": 0.9}, {"boundary_confidence": 0.490930873573666, "end_boundary": {"candidate_id": "b_004", "score": 0.490930873573666, "sources": ["gripper_zero_crossing"], "time": 6.616676555895721}, "end_frame": 98, "end_time": 6.616676555895721, "episode_id": "episode_000000", "evidence": "Tape is being placed into the bottle.", "failure_flags": [], "label_source": "vlm_with_object_state", "label_version": "manipulation.v1", "object": "tape", "object_state_unavailable": false, "object_track_ids": ["obj:object:tape:0"], "overall_confidence": 0.6829233704413569, "phase": "place_object", "reviewed": true, "reviewer_id": "takaki", "segment_id": "episode_000000__seg0003", "smoothing_ops": ["edited"], "start_boundary": {"candidate_id": null, "score": 1.0, "sources": ["human_edit"], "time": 6.2}, "start_frame": 93, "start_time": 6.2, "target": "bottle", "verb": "put", "vlm_confidence": 0.95}, {"boundary_confidence": 0.490930873573666, "end_boundary": {"candidate_id": null, "score": 1.0, "sources": ["episode_end"], "time": 10.066667}, "end_frame": 150, "end_time": 10.066667, "episode_id": "episode_000000", "evidence": "Tape is being placed into the bottle.", "failure_flags": [], "label_source": "vlm_with_object_state", "label_version": "manipulation.v1", "object": "tape", "object_state_unavailable": false, "object_track_ids": ["obj:object:tape:0"], "overall_confidence": 0.6829233704413569, "phase": "place_object", "reviewed": false, "reviewer_id": null, "segment_id": "episode_000000__seg0004", "smoothing_ops": [], "start_boundary": {"candidate_id": "b_004", "score": 0.490930873573666, "sources": ["gripper_zero_crossing"], "time": 6.616676555895721}, "start_frame": 99, "start_time": 6.616676555895721, "target": "bottle", "verb": "put", "vlm_confidence": 0.95}], "signals_url": "signals.json", "task": {"text": "Put the tape into the bottle", "version": null}}